sample_id,subreddit,post_date,unit_type,title,parent_context,post_text
irr-pilot-135,covidlonghaulers,2021-12-02,comment,,,"MRI MRA CTA CT of head & neck EKG

Antinuclear Antibody
ANCA panel for vasculitS
DNA DoubLe-stranded
OSONH
Lupus anticoagulant 
sediment rate
Beta 2 glycoprotan
c4 complement
c3 complement
CRP
cardiocipin mineody
Lipid panel (stroke protocol)
TSH
Vitamin B12
Nucleated red blood cells

As well as the regular degular CBC CMP troponins D-dimer

Sorry if the text on this is a little choppy I’m using talk-to-text"
irr-pilot-136,covidlonghaulers,2021-11-19,comment,,,"H1 antihistamines really helped my lung pain, sob, and fast heart rates. I replaced benedryl with hydroxizine after the doc recommended it since it was safer and had a longer half-life. Sorry you are going through this."
irr-pilot-137,covidlonghaulers,2021-12-27,comment,,,"Mullein! There are ready-made extracts that can be used orally/sublingual, or added to a drink.  It grows wild where I live and I have taken the leaves, dried them out slowly in a low heated oven. At this point I have prepared it as a tea and also have smoked it, which is fast acting to expel and clear my lungs. The dried leaves can also be boiled down until most of the water has evaporated, remove said leaves and then add vegetable glycerin to create my own extract."
irr-pilot-138,covidlonghaulers,2021-12-18,comment,,,I hear you with the belly inflating.  It’s very uncomfortable.  I just took my last super strength turmeric tonight.  I should go get more soon.
irr-pilot-139,covidlonghaulers,2021-12-28,comment,,,"Wonder if the same applies to this new Variant since it stays in the upper bronchial/wind pipe per the studies so far 🤔  

studies show that to be one of the main reasons it spreads that much more quickly and it doesn't fully drop down into the lower end of the lungs which is good news since that's where it harms the most 

All in all I'm over this Virus - hopefully this is the last mutation and we can develop some Herd immunity bad enough dealing with Long Haulers but reinfection ..sheeesh"
irr-pilot-140,covidlonghaulers,2021-11-16,comment,,,"Yeah, I don't miss socializing, just the professional benefits. Many in my industry have adapted to virtual meetups which is a blessing for me in every way, esp now with LC causing me to have significantly lower energy levels than before. But since vaccines, most folks have resumed their preferred in person gatherings.

Which I was *almost* okay with. Then delta stopped by to visit. And vaccinated folks stopped caring about masks in crowded settings. :-/ I'm high risk, not willing to chance reinfection, so unless it's actually essential, I'm riding things out past the potential holiday surge.

I feel paranoid about it until I remind myself it's almost 12mo later and I'm still not recovered. And the anger at getting infected right before I would've been eligible for a vaccine reignites."
irr-pilot-141,covidlonghaulers,2021-12-30,comment,,,"Bought it, but, holding off on taking it.  I’m on Pravastatin and Maraviroc and want to see how that goes."
irr-pilot-142,covidlonghaulers,2021-11-24,comment,,,"Hi! I have totally changed my diet around and take about an hour walk everyday. I eat super clean, and stay on a Mediterranean diet, it was one of the first things I did. But I am so fatigued and dizzy it is hard to work out a ton, thank you for your advice! Just trying to get through it :("
irr-pilot-143,covidlonghaulers,2021-11-24,comment,,,I’ve been in crushing loneliness.  Crushing because I don’t feel like I could be a good partner to anyone right now so I don’t put myself out there but I went into this single too.  I’ve lost all my friends because I stopped texting them back because it felt overwhelming.  It’s my own fault but I’m feeling very extreme loneliness lately.  Thank you for making this post.
irr-pilot-144,covidlonghaulers,2021-12-14,comment,,,"Alternating diarrhea and constipation, sensitivity to most fruits, veggies and  gluten, had many reactions from medicines and supplements but seems like it has gone now, sometimes i bloat and sometimes o fart the entire day. It's been going on since april 2021... Im diagnosed with ibs now! And this shit seems never ending!! Never had any such issues precovid."
irr-pilot-145,covidlonghaulers,2021-12-28,comment,,,The fact that eating flares up your breathing issues suggests that they may not be lung-related. Have you ever visited an ENT doctor? You could have silent reflux. It mimics asthma.
irr-pilot-146,covidlonghaulers,2021-12-15,comment,,,Do you take all three? I’ve been seeing good benefit from natto so far but deciding on serra or lumbrokinase next!
irr-pilot-147,covidlonghaulers,2021-11-22,comment,,,"Hmm. Interesting. I found teas that are deep red in color like hibiscus, hawthorne berry, elderberry, goji berry and also star anise all seemed to help. A bunch of these have quercetin or other very beneficial bioflavinoids as well as great minerals and vitamins. Actually spices that seemed to have very bright colors also seemed to have an impact like sprulina, beet powder,  turmeric and cloves. Just hard to keep up with all of it sometimes. Feel the same way with all the supplements. Just too much to remember to take sometimes."
irr-pilot-148,covidlonghaulers,2021-12-25,comment,,,"Brian fog and head pressure subsided as I started to incorporate daily steady state cardio. At first I would relapse horribly. I coupled this with ice cold showers. It completely went away when I started vitamin D3, upping fat intake. Whatever was left of any sort of brain fog went away completely post usage of fluconazole."
irr-pilot-149,covidlonghaulers,2021-11-18,comment,,,"Hi. My breathing is still weird after 7 months, but I can tell you that you can barely notice the improvement, but it does improve. It’s like 0.001% better each day. It sucks, but the anxiety does make it worse.sit outside and meditate, take inhalers off you can, breathing exercises closing your eyes before sleeping. Those things all helped me."
irr-pilot-150,covidlonghaulers,2021-11-11,comment,,,"Previous infection and fully vaxed.

Got my flu shot on Monday. The day after was not great, like a hangover. Pfizer 1 was a bit worse, Pfizer 2 was similar to flu vax, but lasted longer."
irr-pilot-151,covidlonghaulers,2021-12-13,comment,,,"Resting helps prevent the worse relapses but time is the only true healer in this so far. 

Be careful too. My post exercise relapses would hit 3-7 days after the workout. Sneaky. And the relapses would stick around for several days to weeks."
irr-pilot-152,covidlonghaulers,2021-12-09,comment,,,"My doctor has me on Carvedilol (25 mg twice a day) and I take 325 mg asprin at night, when my symptoms are usually the most extreme. Before I got prescribed medicine I would take asprin which helped some with palpitations."
irr-pilot-153,covidlonghaulers,2021-11-12,comment,,,"Ended up finding some holistic colonoscopy place. Tube goes in, flush your intestines with water for 45 minutes

Took 3 procedures

Thankfully that stage is behind me now"
irr-pilot-154,covidlonghaulers,2021-12-30,comment,,,"Ive heard good things about the throat sprays, although Ive tried things like lidocaine with little effect. I am not vaccinated due to autoimmune issues."
irr-pilot-155,covidlonghaulers,2021-11-12,comment,,,"Still here, got sick april 2020, not much difference. POTS, PEM, Fatigue, MCAS you name it I got it. Trying the nattopeptase and serrapeptase thing since a couple of days, feeling a bit better, but could be placebo."
irr-pilot-156,covidlonghaulers,2021-12-26,comment,,,"It maybe but it can lessen in time, and improve. It’s getting the right diagnosis- like what kind of PoTs you have... I have hyperadrenalic PoTs. I get horrible adrenaline surges which get bad at night. I’m taking Amtripyline for my sleep... it really saves my bacon and helps with headaches"
irr-pilot-157,covidlonghaulers,2021-12-17,comment,,,"I understand not spreading disinformation, but it’s so frustrating to not even be able to have an intelligent conversation about certain topics without getting banned or ridiculed. Sorry that happened to you."
irr-pilot-158,covidlonghaulers,2021-11-05,comment,,,"I google her name every now and then. [Here is another one](https://www.youtube.com/watch?v=yXnUW4HpJNs) I got good things from. 

When the vaccine became available, Dr. Klimas had the answer for me [here.](https://www.nova.edu/nim/To-Vaccinate-or-Not-with-MECFS.html) She is my unofficial doctor."
irr-pilot-159,covidlonghaulers,2021-11-05,comment,,,"After 19ish months it’s been a bit easier to handle, but still get overstimulated when I have to be productive. I used to be like this before covid and usually a few hours to recover did the trick, now I need a day or two to recover. I did stop work for a few months after I got LH as the overstimulation would start as soon as I was starting to work on something."
irr-pilot-160,covidlonghaulers,2021-12-01,comment,,,"Got vaxxed, very little side effects, got super exposed to covid and didn't get it. Couldn't be happier."
irr-pilot-161,covidlonghaulers,2021-12-17,comment,,,"Yep, the insomnia is horrible. Some things that have helped me:

-CBD/CBG at 500 mg before bed (one of the best things ever, I get mine from TweedleFarms.com)

-Making sure I'm full, not hungry at all. Keeping snacks by the side of the bed for when I wake up.

-Childrens Tylenol, since fevers seem to be waking me up. This works well, but it can damage your liver over time so I use it sparingly.

-Benadryl (I also use sparingly due to it being linked with dementia later down the road)

-Vitamin D supplements in the morning to help regulate melatonin

-Red/infrared light therapy device on the back of my head and neck

-Getting 13-12 hours of ""sleep"" to make up for the insomnia"
irr-pilot-162,covidlonghaulers,2021-11-12,comment,,,"Agree, fully! Since I'm only in my 40s (parent, a career I was happy with, etc.) I was hopeful this wouldn't be the case, but then I tested with values in all 3 AChRs from neurology and that was my come to Jesus, so to speak. I was wondering how people had the competency to call and make appointments to get into the doctors soo soon, energy see soo many doctors, clarity to remember their issues, could just think clearly enough to *talk* to the doctors about what was/is going on. I never had those experiences. Choline has helped me a lot, I don't feel brain dead any more, or like my brain is anesthetized so I know it's there but can't use it voluntarily. So yeah."
irr-pilot-163,covidlonghaulers,2021-11-05,comment,,,"Wow, I deadass thought the same when I got my second shot. Felt great for a few weeks. Then I started exercising again and I felt the issues come back. Going to start taking supplements and only exercising lightly. Hopefully this bs stops for good eventually."
irr-pilot-164,covidlonghaulers,2021-11-18,comment,,,"O2 levels are usually within the acceptable level 96-98 - yet I can still be gasping, which makes sense when you consider the micro-clotting theory and failure to deliver O2 to damaged tissue sites. There's oxygen in the bloodstream, but it can't get to the places that needed. (I mean, who really knows what's happening - but that's current thinking anyway).

Do you have issues with your O2 levels?"
irr-pilot-165,covidlonghaulers,2021-11-17,comment,,,"Very common. Id recommend magnesium, benadryl, weed edibles (if you roll that way), and/or ativan if youre desperate."
irr-pilot-166,covidlonghaulers,2021-12-23,comment,,,Every morning for like 18 months I would vibrate when I woke up.. it felt like the demons left a cell phone on vibrate in my stomach.. eventually this simmered down and I don’t feel it often but I’m on month 21 now. Horrible virus!
irr-pilot-167,covidlonghaulers,2021-11-15,comment,,,Make sure to expand your blood volume with lots of water and electrolytes. Trioral from Amazon or nuun tablets are really good. It raises my blood pressure and helps my orthostatic intolerance the most.
irr-pilot-168,covidlonghaulers,2021-11-25,comment,,,"What have you tried so far? I think a lot of people with come and go sob feel better with anthistamines, have you tried that? Do you have pain or just sob? Have you had imaging done since you got over your acute illness?"
irr-pilot-169,covidlonghaulers,2021-12-09,comment,,,"I had this in the first 4 month after my Pfizer vax. Pacing, Statins, Magnesium and time decreased the problem for me."
irr-pilot-170,covidlonghaulers,2021-11-05,comment,,,"Yeah there's some early evidence to suggest that a mitochondrial process may be one of the causes. It will be interesting to see the results!

Is phos-cal something you can buy or prescription access only?"
irr-pilot-171,covidlonghaulers,2021-11-18,comment,,,Thank you for this reply. I’ve been very up front with everyone that i’m not myself right now and can’t do what i used to
irr-pilot-172,covidlonghaulers,2021-11-19,comment,,,"I just read something interesting regarding ACE2 receptors , inflammation and how Kobophenol could actually prevent chronic inflammation .

Kobophenol is isolate from the Roots of Caravans sinica 

https://www.sciencedirect.com/science/article/pii/S221475001830132X"
irr-pilot-173,covidlonghaulers,2021-11-14,comment,,,Shortness of breath! It has its moments but nowhere near as bad as last year where I felt like I couldn't breathe! The nasal spray I'm currently on for the inflammation in my nose majorly helps with that!
irr-pilot-174,covidlonghaulers,2021-11-29,comment,,,"YES! Mine would be worse as I started to relax. For example, watching TV I would jerk or twitch and falling asleep.  I even got full body spasms at times.  Kind of similar to myoclonic jerks, but more intense.  Interestingly, if I went and slept sitting up or on an incline they would be less frequent to where I could fall asleep uninterrupted. I'm assuming this has something to do with circulation/electrolytes/cardiovascular."
irr-pilot-175,covidlonghaulers,2021-11-23,comment,,,I got prescribed medication after three appointments where my bp was high. And ER just let me go home after checking me out.
irr-pilot-176,covidlonghaulers,2021-11-10,comment,,,"I had it about six months after infection.  It coincided with some insomnia, which was also a new thing for me...I was waking up every hour on the hour, pretty much.   Once I started sleeping more soundly, the twitching stopped."
irr-pilot-177,covidlonghaulers,2021-12-17,comment,,,"I have no idea if I have access. I'd imagine so, it's just convincing the right doctor in the right specialty to refer me. Who would I go to for that?"
irr-pilot-178,covidlonghaulers,2021-11-10,comment,,,"I'm suffering from this for over 5 months. I have severe throat and swallow pain everyday and it's been nightmare. Diet is good, got a wedge pillow and have been doing PPIs for months with no help. The throat pain is unbearable, please any suggestions?"
irr-pilot-179,covidlonghaulers,2021-12-07,comment,,,"Does being sick and not taken seriously count as a symptom? Cause that shit is weird AF...especially in 2021. We're expected to acknowledge and respect every individuals own version of reality...unless you have long covid or are vaccine injured.

But more seriously. I've had a heart attack at 29, that was a wild experience.
I also get these wildly intrusive, vivid, and morbid thoughts. I'll just zone out for 5 or 10 minutes and my brain takes me on a terrifying ride that's hard to snap out of. It's like having a nightmare while you're awake."
irr-pilot-180,covidlonghaulers,2021-11-12,comment,,,"Not sure but something is up with the immune system and covid/vaccines. I developed small fiber neuropathy 3 weeks after 1st pfizer, that was 09/13 and I’ve been jacked up with that since. Got covid 10/25 and now dealing with symptoms of that lingering. There are many parallels between LC and LV people. So who knows maybe it is caused by a overreacting immune system."
irr-pilot-181,covidlonghaulers,2021-12-25,post,Booster side effects worse than the 2nd shot,,Been almost 36 hours and still feeling like I got hit by a bus. Definitely not flu like — the nausea and aches and generally off feeling are 💯 covid-reminiscent. Hoping Christmas Day is better!
irr-pilot-182,covidlonghaulers,2021-11-10,comment,,,I understand your situation and anxiety. I felt much worse after a month with Moderna. But I know another round of coronavirus has the potential of an even worse experience. Currently I feel the best I have been for the last 20 months. So the setback was only short term and it protected me. I have anxiety of getting the booster but I think I will do it anyway for the added protection.
irr-pilot-183,covidlonghaulers,2021-11-17,comment,,,I take 20-40 mg famotidine and 1 g antacid about 30 mins before bed. I had a reaction with wheat before covid but only in beer and not insomnia. Now after 20 months it seems like there's a higher threshold with the wheat thing. I can have small amounts of beer and bread but I usually avoid them completely.
irr-pilot-184,covidlonghaulers,2021-12-29,comment,,,"Hi. Thank you so much. No, I haven’t tried to take it out but I’ve been thinking about it. Just to get my body back to baseline. 

I’ve had two ultrasounds both nhs and private and so far, IUD placed properly. 

PID is something I haven’t thought about at all. May I ask what makes you think of PID? I’m going to start researching that now. 

Thank you again! Appreciate it"
irr-pilot-185,covidlonghaulers,2021-12-29,comment,,,"I have seen success with Keto diet (<25g carb per day). Keto is a naturally anti-inflammatory diet. I can’t say for a fact that it works, but I felt good while doing it.

It’s very annoying and expensive to maintain though, so I stopped after 12 days."
irr-pilot-186,covidlonghaulers,2021-11-19,comment,,,"Gabapentin didn't help my joint pain either. Zero effect. I was surprised that lyrica helped. It could probably cause similar side effects though, and certainly similar withdrawals.

There is one other thing that helped my joint pain... CBC. It's a cannabinoid like CBD (which didn't help me). The effect only lasted 4 hours though."
irr-pilot-187,covidlonghaulers,2021-12-21,comment,,,"I got covid,  then post- covid booster. 
Here,  recovered patients get a booster 6 month after recovery,  standard protocol. 

Thanks for your comment!"
irr-pilot-188,covidlonghaulers,2021-11-04,comment,,,"I've had strong palpitations (doctor can't hear my lungs over my pounding heart) since the beginning in Mar 20, until a few months ago when I started taking COQ10 (general recommendation from me/cfs doctor). It does not complete eliminate the palpitations as I still get it triggered by things like food but it eliminates the constant every second of everyday. When I first take the pill it may make me feel worse for the day but the subsquent days the palpitations are gone when I don't take it."
irr-pilot-189,covidlonghaulers,2021-11-16,comment,,,Yes you do! Just remember the only thing that really works is pacing and not overdoing it. I for instance recovered with an antiviral but this won't work on everyone.
irr-pilot-190,covidlonghaulers,2021-12-19,comment,,,"Patterson has also said the spike they are finding in post vax long haul is “mutant” , not the same as the spike produced by the virus."
irr-pilot-191,covidlonghaulers,2021-12-06,comment,,,"Terribly sorry man you had to go through this. Try intermittent fasting like 16/8 and see if you could start low dose colostrum (e.g. 500mg/d) taken first thing in the morning. How is your Lactobacillus and Bifidobacteria? Most people with CFS are low in lacto, Bifido and E. Coli. Also try and boost your short chain fatty acids especially butyrate. You can get it in ghee and grass fed butter. I take one tsb ghee before bed and it literally lifts my mood. Read on its anti-inflammatory properties."
irr-pilot-192,covidlonghaulers,2021-11-18,comment,,,"Same here. These are things I've tried, maybe us sleep deprived bunch can share our trial and errors lol-

 \-valerian root (awful smell. really helped relaxation but seemed to give me premature heartbeat after a while)

 \-melatonin 5mg (would wake up after 5 hours or so)

 \-hydorxyzine (prescribed by previous pcp who told me it's just anxiety. Helps with sleep but it's intended for short term use)

 \-benadryl (actually helps with a long night of sleep but drowsy for the next day. remember NOT to get the non-drowsy type cause that's what we're aiming for!)

 \-just eat shit ton of food and use the food coma to fall asleep (awful acid reflux)

 \-drugstore pain relief PM (acetaminophen & antihistamine) (does the job so far but I'm only a week in rn)"
irr-pilot-193,covidlonghaulers,2021-11-16,comment,,,"\+1. Going back to the other posts ive read about large population of long haulers having b-adrenic auto antibodies, which seems to be the same auto-antibody in POTS patients, and considering the overlap in symptoms, I'd say auto-immune damage is most likely.

From the specialists I have spoken with (neurologists and immunogolist) they both said that the infection caused damage, and now it needs time to heal, there is no ""cure"" so to say.

It seems like the only real way to assist that healing is a healthy diet, anti-inflamatories and supplements which are proven to assist auto-immune conditions, like l-glutamine and vitamin D."
irr-pilot-194,covidlonghaulers,2021-11-10,comment,,,"I am so sorry you are going through this. I think a lot of us understand the difficulty and pain associated with long covid. The anxiety and depression from this is very physical and difficult. I personaly started to seriously meditate, I also had a few sessions with a hypnotherapist which helped quite a bit.

A quick question did you have a vaccine within the last few months? My first dose set me back significantly."
irr-pilot-195,covidlonghaulers,2021-12-08,comment,,,"I posted a legitimate article from a legitimate website for medical information.

That information could be very beneficial to you if you’re struggling with long Covid. What better way to show gratitude and thanks than to insult me and try to devalidate the research I posted without even reading it?👍"
irr-pilot-196,covidlonghaulers,2021-12-25,comment,,,"I use edibles - sativa mostly (a strain that makes me more creative, and not indica, which makes me tired) - and get the munchies. For some reason, I can taste layers of flavor that I don't really taste otherwise and this actually makes food irresistible. So much so that I am glad I don't have enough money to buy it often bc I'd be big as a house. I've lost 90# (needed but I'd rather not do it this way) and am still losing.

It also helps with some other disorders I have (cPTSD and osteoarthritis). Be careful, it freaks some people out, so if you decide to try it, go slow.

Happy holidays!"
irr-pilot-197,covidlonghaulers,2021-12-17,comment,,,"March 2020 for me and I’m still dealing with the exact same thing. I’m on Zoloft, which helped with the depression. I’m not as smart as I once was. I even changed jobs because I couldn’t do my old one without making mistakes. My new job is much more forgiving."
irr-pilot-198,covidlonghaulers,2021-11-29,comment,,,"interesting i take a ton of supplements also including all of those except natto serra and beta-blockers. my cardiologist said i didn't need them bc my hr only jumps 10-20 bpm upon rising, i also do breathing exercises im about to hit the 3 month mark in a couple weeks. i didn't take aspirin bc i heard it's causing tinnitus in some and you're not supposed to take natto and aspirin together"
irr-pilot-199,covidlonghaulers,2021-12-04,comment,,,"I believe some of the SARS COV 1 were recovered in three years, the study was stopped at 10 years and there were some still ill and no more follow up on them."
irr-pilot-200,covidlonghaulers,2021-12-20,comment,,,Doing drugs is the only reason I can deal with brain fog. It just feels like being super baked with no euphoria. No drug can prepare me for malaise though
irr-pilot-201,covidlonghaulers,2021-12-18,comment,,,"I have only had itching and painful swelling in the hands. I did read you should avoid drinking or eating cold but I mean I’m no specialist. What if both our cases are very different? 
Latest symptoms are pain on all the arms, muscle, joint, soreness. They fall asleep again which had not happened in months. I did recently stop my magnesium which seems it may have been irresponsible now that I think about it. I hope we get better. 
Sending healing vibes."
irr-pilot-202,covidlonghaulers,2021-12-16,comment,,,"That's the only thing that helped me with the fatigue so I'm glad I took it, I was able to have almost normal days. But symptoms came back after I stopped unfortunately, so I should stay on long term low dose Prednisone until the fatigue goes away.
Be careful of the insomnia you can have if you take it too late."
irr-pilot-203,covidlonghaulers,2021-12-06,comment,,,"I saw this, I haven’t tried to lift a TV but i lifted a heavy ass pumpkin on Halloween. Probably weighed around 70-80lbs maybe im way off but for sure over 50lbs. and i felt out of breath but recovered pretty quickly. I also can lift water jugs without any symptoms"
irr-pilot-204,covidlonghaulers,2021-11-07,comment,,,I hope your symptoms improve. I am very pro vaccination. Unfortunately one of my coworkers started experiencing long hail symptoms after her second dose of the vaccine. It’s been since March and her symptoms remain the same and test show up with nothing. I’ve told her about people in your situation and it has given her a bit of hope.
