sample_id,subreddit,post_date,unit_type,title,parent_context,post_text
irr-pilot-334,covidlonghaulers,2021-11-13,comment,,,"I want to get it. And plan too. I really think this will be yearly and the best way not to get it again. I did have horrible reactions to the vaccine, so I’m more inclined to get it."
irr-pilot-335,covidlonghaulers,2021-11-11,comment,,,"Gosh what a similar story! Good luck to you too. I’m actually doing so much better as of early October. I got a POTS diagnosis and started drinking electrolyte solution daily and oh my gosh, that has resolved most of my symptoms. Miraculous. I supplement that with ibuprofen or Naprosyn daily, which seems to help the remaining brain fog—perhaps I have brain inflammation that it reduces, all I know is every time I go off it, the fog returns in about 3 days. Today I had no problem working until 5 PM. That is a milestone."
irr-pilot-336,covidlonghaulers,2021-11-30,comment,,,Pre covid I lifted weights 5 or 6 times per week and once I got Covid I didn't work out for about 6 weeks. I started slowly and I am still getting shortness of breath 4 months later. But it's manageable.
irr-pilot-337,covidlonghaulers,2021-12-01,comment,,,"Started long haul in Aug 2020. Main symptom is insomnia and higher resting HR after increases in activity above my threshold (PEM). Got the 1st Pfizer shot in May. Felt fine for about 9 days, and then my LH symptoms were exacerbated. I went from being functional and just unable to do intense exercise to being basically couch-bound for a couple of months, because the insomnia and associated fatigue got worse. I’ve returned to my previous LH baseline pretty much. I have not gotten another shot. :-/"
irr-pilot-338,covidlonghaulers,2021-11-16,comment,,,"I tested positive for reactivated EBV while sick with COVID. I can’t remember where, but I’ve read that this is happening to many COVID patients. I don’t know if it can be called common, but it doesn’t seem to be a rare occurrence."
irr-pilot-339,covidlonghaulers,2021-12-17,comment,,,"I've taken them for years because if panic attacks. I'm addicted even though they are prescribed.

However, I reached a good place in trauma therapy and have reduced my use by 3/4 (still need one for bed, but that's getting kicked next year as my coping mechanisms improve) and I quit Ambien this year, too.

I would not advise going on these ever, unless you have PTSD or something similar. Even then, have a plan to get off of them asap."
irr-pilot-340,covidlonghaulers,2021-11-10,comment,,,"Lol years seem like a whole lot of time to get off a med. But honestly if it helps with the adrenaline rushes I am gonna take the the risk of infrequent use once a week max whenever that horrible thing starts.

Thanks for the advise!"
irr-pilot-341,covidlonghaulers,2021-11-23,comment,,,"Same thing happened to me. Doc suggested a probiotic called 'Align', and miralax. I also eat small portions, and two or three smoothies daily. I've noticed significant improvement"
irr-pilot-342,covidlonghaulers,2021-12-22,comment,,,"This probiotic I take once a day on an empty stomach in the morning.

The TMG is for methylation and you can take as needed. You can also take electrolytes as we seem to have issues with dehydration."
irr-pilot-343,covidlonghaulers,2021-12-29,comment,,,"If you find anything please update us. I’m also in the UK and my GP is hopeless as they can’t or won’t prescribe anything.

They keep repeating the same tests as if results are going to differ."
irr-pilot-344,covidlonghaulers,2021-12-07,comment,,,"Naw the poisoned feeling and shakiness are their own beasts, but the Bentyl helped me feel settled and stopped the diarrhea.  This is obviously not medical advice, but you could ask your GI doc about it."
irr-pilot-345,covidlonghaulers,2021-11-10,comment,,,"Pretty sure it can vary very significantly from person to person, which is why there are strict recommendations on how doctors offices are to take it (which most don’t follow.) even having a full bladder can throw off your BP. In my experience it tends to go up about 5-10 sys and dia when standing, but I always give myself a couple mins to breathe and relax my mind prior to taking because I get white coat hypertension and just the act of turning the machine on gives me anxiety"
irr-pilot-346,covidlonghaulers,2021-12-18,comment,,,"Fiber is great for the gut but you can get it without eating pasta/bread/white rice for example, which are generally high carb low fiber. You can get fiber from vegetables, fruits, nuts, grains, etc., many of which are relatively low carb (though some need to be avoided).

It’s definitely tough to do this diet when you’re limited to low histamine foods though. I would focus on lowering your histamine levels until you can tolerate more variety before trying it."
irr-pilot-347,covidlonghaulers,2021-11-02,comment,,,I got the Moderna booster last week after Pfizer the first time. A little arm soreness but otherwise OK.
irr-pilot-348,covidlonghaulers,2021-12-27,comment,,,"Could be that just one of them is working differently. For me eg. Nac sometimes doesnt work at all, and some days I straight up feel like Im om cocaine"
irr-pilot-349,covidlonghaulers,2021-12-26,comment,,,You need a new one for sure. If it autoimmune you can different medicines or get ivig for example. They can try you on a steroid or a couple other immune drugs used for other autoimmune conditions.
irr-pilot-350,covidlonghaulers,2021-12-20,comment,,,"Yes. Many doctors have suggested spacing out the doses farther apart. Especially since you had covid less than 6 months ago, you’re fine to wait. Doctors would never typically suggest you intentionally get a vaccine when you’re sick, especially when the vaccine has shown heart complications. 

To the person that said covid can cause heart complications, no duh, that’s why she’s here in the first place. The chances of you getting covid when you just had it in sept are slim to none. Just wait for your second dose until you aren’t nervous."
irr-pilot-351,covidlonghaulers,2021-11-25,comment,,,"The initial Pretorius findings were only recently revealed and they’re already doing the above-mentioned study. They’ve also mentioned a collaboration with another group in San Francisco. 

HELP Apheresis is a treatment but it doesn’t target the reason for the microclots. They need to get to the source of the problem, which is why there is aberrant gene expression creating microclots and preventing microclot breakdown. HELP Apheresis just physically removes the microclots but there have been bad reactions to it."
irr-pilot-352,covidlonghaulers,2021-11-10,comment,,,"The reply is much appreciated.  I'm trying to figure out if it's vaccine induced or long covid that's been aggravated by the vaccine.

 Prior to this the only issue I had was just a general fatigue.  

I'll keep digging for info, reading and listening."
irr-pilot-353,covidlonghaulers,2021-11-13,comment,,,"I am pumping myself with 5 htp, ashwagandha, cordyceps, chamomile, glutamine, arginine and many other supplements. I seem to have mostly recovered."
irr-pilot-354,covidlonghaulers,2021-12-01,comment,,,"I would seek out an acupuncture therapist. I've been seeing one since March 2021 and it's done a lot to help my inflammation and I rarely have tinnitus flare ups anymore. 

I have also been on an anti-inflammatory diet that is challenging but helps a lot."
irr-pilot-355,covidlonghaulers,2021-12-26,comment,,,"I grind my teeth at night, and have since I was about five years old. Dentist has told me it for over a decade now, and for most of middle school and elementary I used a rubber mouthguard, but sometime during high school I almost choked on it and haven’t used one since. I now deal with the jaw pain weekly, but it’s better than my paranoid ass choking on a mouthpiece in the middle of the night."
irr-pilot-356,covidlonghaulers,2021-11-17,comment,,,"The FLCCC plan says to take this for around 2 weeks or 15 days I cannot remember exactly, has anyone tried stopping at this point rather than continue with the drug?"
irr-pilot-357,covidlonghaulers,2021-12-26,comment,,,"My GI doc diagnosed me with the same ‘Post infectious IBS from COVID’ he recommended IBGuard which is over the counter. I found Heather’s Tummy Tamers on Amazon and it’s the same thing but a bit cheaper (180mg Peppermint Oil). 

I do have to say once I started taking 1 daily I have had zero problems with the severe abdominal pain and random bouts of diarrhea."
irr-pilot-358,covidlonghaulers,2021-11-12,post,"i have been feeling *horrible* after eating every time, no matter what I eat lately. like scary bad",,"infected feb 2020 confirmed laboratory positive, life has been a roller coaster since

I have had to take a few courses of clindamycin for recurrent staphylococcus aureus sinus infection and have noticed even low histamine foods I have always been able to tolerate I am completely unable to eat

any advice would be greatly appreciated on what could potentially be going on"
irr-pilot-359,covidlonghaulers,2021-12-26,comment,,,"Yeah it actually has traumatized me. The first month was brutal. Nightmares every night and then the days were real nightmares. It goes away but then you’ll have to relearn how to live in the world (what I’m working on now).

I highly recommend you get a therapist and strap in for the ride! But know you’re not alone"
irr-pilot-360,covidlonghaulers,2021-12-11,post,Squats caused exhaustion?,,Possibly a weird question. I have been a long hauler since March 2020. I have improved greatly since getting 2 doses of the Pfizer vaccine and finally getting treatment for pneumonia that they said I could have had in one lung for OVER A YEAR (because doctors don’t listen to us…but that’s another story… ). Anyway. I have a fairly active job (mostly walking around all day) but I decided to do some squats this week. And I’ve been soooooo fatigued again ever since. Could doing some squats really have knocked me on my ass like this??!
irr-pilot-361,covidlonghaulers,2021-12-02,comment,,,"I take magnesium vitamin once a day, as far as the diet goes I’m mainly eating chicken, fish like salmon and tuna steaks, plain yogurt, chia seeds and flax seeds, blueberries, strawberries, and any kind of dark green vegetables. I’m new to the diet, so I’m still trying to learn what foods are good and what I have to avoid, it’s definitely a learning process"
irr-pilot-362,covidlonghaulers,2021-11-17,comment,,,"He is doing lab work, an echocardiogram, and a 24 hour heart monitor next week, but made it clear he's not too worried. He talked about how being underweight can cause problems, which duh. I tried to get them to understand that my symptoms vary day to day, and provided the example that my heart rate was in the high 90s, low 100s resting the other day, and shot up to the 120s 130s when I took just a couple steps, but you know, anxiety and all lol"
irr-pilot-363,covidlonghaulers,2021-11-17,comment,,,"I went to the dentist a few months ago and had 6 cavities filled over a couple weeks (that was my first time going in over 3 years) and then had my wisdom teeth removed a few weeks after that, which was also just local anesthetic. I didn’t have any problems or have a relapse afterwards. They did have to monitor my blood pressure & heart rate just to make sure it wasn’t going up too high since my resting HR was already concerning and local anesthetic can make your heart rate go up even more, but I didn’t any problems once the numbness wore off, and my heart rate went back under 120 without any issues. I think you’ll probably be fine!"
irr-pilot-364,covidlonghaulers,2021-12-06,comment,,,"I share the same symptoms as you, as well as body aches and nerve pain in legs and brain fog, derealisatuon.

I remember many years ago, I tried to explain to doctors I was occasionally experiencing simple partial seizures at night.  They didn’t believe me so nothing was pursued.

But during my 12-15 months of long Covid, I’d often fall asleep and wake up in a jolt with my heart racing fast; it was a horrible feeling. 

Your epilepsy diagnosis rings a bell with me."
irr-pilot-365,covidlonghaulers,2021-11-11,comment,,,"Were you able to work while you were recovering? I've been hauling for almost a year. I just accepted a part time job, 24hrs a week because I'm feeling about 70% and want to get out again. I'm hoping it won't have negative consequences."
irr-pilot-366,covidlonghaulers,2021-11-20,comment,,,"Thanks for the tip and detailed info - I'll have to look into it! 

I greatly appreciate the caution about sugar too. I happen to be well aware but when it was the only normalcy I had for taste it was hard not to indulge sometimes! I've cut most of it out just because i don't like how it makes my body feel but I'm hoping my taste continues to improve so it isn't a coping mechanism anymore"
irr-pilot-367,covidlonghaulers,2021-12-10,comment,,,I'm an idiot because it took me a good minute to figure out what Ig was .. lol..  Well I have an account and never use it.. that's my excuse.
irr-pilot-368,covidlonghaulers,2021-12-21,comment,,,"Please be careful with alcohol. I was feeling so much better that I thought I could have a glass of wine here and there.  I was fine on Thanksgiving, but last weekend it threw me into a relapse like I hadn’t experienced for some time.  I got away feeling fine a few times then I had an Mast cell attack with almost immediate neurological symptoms.

You might be fine, but it’s a real bummer to relapse when you’re feeling good."
irr-pilot-369,covidlonghaulers,2021-12-03,comment,,,"I agree with CouplePurple’s comments 

Also: I’m on Wellbutrin, I started it not for long Covid but for depression (which was in part pandemic related though). I have found it helpful both for energy and mood, though not as effective as it was when I started it."
irr-pilot-370,covidlonghaulers,2021-12-17,post,"Was it worth getting re-tested today, even though my symptoms started over a year ago?",,"Rapid test was negative, PCR test hasn't come back. Was there a point to doing this? Thought it might show something.

Haven't tested positive in a nasal/PCR test nor an antibody test. Problems for me started in October 2020. My mom was tested in November 2020 after feeling cold, she came back negative. It's possible we all got it but just won't test positive for some reason. Not sure if they did the PCR test for her. Dad tested negative this week too after feeling cold."
irr-pilot-371,covidlonghaulers,2021-12-28,comment,,,"Hi! I got covid in March 2021 and from April to last month I had chronic insomnia. I understand you and that feeling that your heart will stop if you fall asleep. 
I remember that I hadn't slept in 24 hours in October and stayed on the phone with my mother all night. I had a panic attack and I'm going to have a heart attack.I had arrhythmias and even a chest pain.I realized that I couldn't live like this anymore, because I was tired and I couldn't even leave the house. so I forced myself to go for walks every day and started taking melatonin. now I have a normal sleep schedule, I manage to sleep even 8 hours a night but unfortunately I dissociate. I wish you the best, you will get over this 🥰"
irr-pilot-372,covidlonghaulers,2021-11-08,post,Micro-clotting blood tests-what do I need?,,"My respiratory doctor doesn’t *think* I have micro-clots, as I’ve had a few extensive scans, but is happy to order blood tests to check via that route too. He mentioned checking my D-dimer and vitamin D levels, but is there anything else I should ensure is on the list?

I was considering whether to ask for my arterial and venous blood gas levels to be checked too. I’m in the UK in case that makes a difference."
irr-pilot-373,covidlonghaulers,2021-12-18,comment,,,"Oh gosh, you poor thing! I'm sure like my long covid, your vax induced long covid will get better. It took me 15mths  so hang on in there.... GOOD LUCK"
irr-pilot-374,covidlonghaulers,2021-11-11,comment,,,"CoQ10 was definitely helpful for me as well in terms of energy, but came at the cost of mild insomnia, as you noted."
irr-pilot-375,covidlonghaulers,2021-11-22,comment,,,"Oh you too!! I really feel for you 😔  Neurological symptoms are the worst! I have a feeling the giddiness correlates with the high antibodies. I recall someone here mentioning it started feeling better as the antibodies numbers were going down and this may point to autoimmunity as your doctor was suggesting. This makes me question getting more shots at this point.

Can you remember when did the giddiness start? Was it after the infection or vaccine?"
irr-pilot-376,covidlonghaulers,2021-11-04,comment,,,"""If for example, you have been suffering ME/CFS for 20+ years, then I believe re-training the brain out of these negative symptom patterns can take longer, say 3/4 months to a year plus, but for those who are earlier on in their Long Covid journey, it may be matter of a few months or even weeks.""

Full of trash is actually an understatement, lol!"
irr-pilot-377,covidlonghaulers,2021-12-28,comment,,,"HAHAHA

Oh, yes. Anxiety. It’s ALWAYS anxiety. I’m an old mono longhauler with EDS. Doctors are like firemen and cashiers and welders and every other kind of profession. Some of them aren’t good. Some of them downright sucks. And sometimes they just get it wrong. If a doctor isn’t helping you, go to another. You wouldn’t go to a mechanic that never fixed your car or even so much as listened to what was wrong with it and came back with “have you tried putting oil in it?”"
irr-pilot-378,covidlonghaulers,2021-11-30,comment,,,"Covid causes brain inflammation. This is a shot in the dark but your body produces more melatonin at night, which is supposed to be a potent anti inflammatory and might explain why your cognition improved after 9 pm. I don't know why that stopped unless the inflammation led to permanent damage. 

I would try taking fish oil (1-2 g per day) and following an anti-inflammatory diet to start. Try eating some probiotics every day to help with gut health which is thought to influence brain function. Sorry you're going through this too"
irr-pilot-379,covidlonghaulers,2021-12-17,comment,,,"Oh yeah, twice. Took me a little while, about two months. The first instance was pretty rough due to asymptomatic infection. Second time around wasn’t quite as bad  since I knew I knew I was COvid positive that time and had experienced everything before. Two months of waking fever dreams each time."
irr-pilot-380,covidlonghaulers,2021-11-28,post,Is there interaction between vaccine (Pfizer) and antihistamines?,,"Hello all, I hope you’re having a nice day.

I got the first dose at the end of July and I’m thinking about taking the second dose next week.

The thing is that now I’m taking antihistamines (Zyrtec) and I’d like to know if it can interact with the vaccine or if some of you got the jab while taking antihistamines.

Is there interaction? Will it lessen the effect? Should I stop it before and or after?"
irr-pilot-381,covidlonghaulers,2021-12-11,comment,,,"After a couple days on the cbd I was definitely back under control, but it took a few more weeks taking it after that to really keep it at bay. Adding in L theanine and ashwaganda helped me transition off the cbd and kept my flair ups from coming back"
irr-pilot-382,covidlonghaulers,2021-11-08,comment,,,"You could start lower than that. The 1/4 teaspoon is probably a good maintenance dose but being acutely ill, a short term stint of a larger dose my springboard getting better faster. I don’t think a teaspoon is excessive though."
irr-pilot-383,covidlonghaulers,2021-11-28,comment,,,"I also had some luck with now brand immune renew, it helped me cough stuff out as well. And I have used something called andrographis that I think helps."
irr-pilot-384,covidlonghaulers,2021-12-11,comment,,,"I didn’t know the pain relief could inflame issues! I’ve had quite a few dentist appointments with injections this year and I can’t say I’ve noticed any issues from them, just the usual fatigue from having been out for a couple of hours. But I don’t think my LH is routed in MCAS issues, so that might be why."
irr-pilot-385,covidlonghaulers,2021-11-28,comment,,,No breathing issues besides a few weeks of anxiety when the symptoms began in July 20 (following coughs in March/April).
irr-pilot-386,covidlonghaulers,2021-11-07,comment,,,"Low acid coffee is a huge improvement over my normal go-to coffee (Fog Chaser by San Francisco Bay Coffee Company), which thankfully with the help of an H2 anti-histamine I can drink again on most  days. But the low acid version mentioned in that coffee post really isn’t bad, thankfully.

Doing the Bulletproof Intermittent Fasting mentioned in that thread helps with GERD also. 

Small update from that post: I added Olive Oil to the recipe recently after finding out how good it is for you. Strong antioxidant and tastes good in the coffee (at least to me it does but it’s a healthy fat so kinda makes sense  that it wouldn’t be disgusting).

Thanks for mentioning the cold brew method will definitely look into that!"
irr-pilot-387,covidlonghaulers,2021-11-16,comment,,,"I feel like both Pepcid and Claritin has helped!! So I take either Balance ONE probiotics, or Just Thrive probiotics. I’ve noticed both of them have had really good effects for me so far. I can’t remember the first antibiotic that I took (that one didn’t affect me too badly), but the second one which really put me over the edge was Augmentin!"
irr-pilot-388,covidlonghaulers,2021-12-20,comment,,,"I Feel better, like at a point where all the supplements dont seem to be furthering anything. He is okay with me stopping those."
irr-pilot-389,covidlonghaulers,2021-12-28,comment,,,"I’m a year post covid and the palpitations were the worst for me. I had them daily and nonstop. Once I hit a year they’ve slowed down a ton. I stay hydrated as much as I can and that seems to help. Electrolytes. I feel for you because they’re the worst. I still ge them some
But not every heart beat like I was."
irr-pilot-390,covidlonghaulers,2021-11-20,comment,,,"Mine were inexistant post infection and after my 2nd Pfizer jab I had a tiny amount (390/um) of the spike protein antibodies. I'll be taking the booster when it's available, even though I'm frankly not relishing the relapse that comes with it"
irr-pilot-391,covidlonghaulers,2021-12-01,comment,,,"Yes, it can cause nerve damage. There are certain peptides that can help with the recovery. I've been having great success with it."
irr-pilot-392,covidlonghaulers,2021-12-04,comment,,,"I was vaxxed back in March and got a booster a month ago.
Getting covid again would be far worse than any Vax side effects.

After Vax 2, I got my smell back. No other big changes."
irr-pilot-393,covidlonghaulers,2021-12-30,comment,,,"Bed, hydration (liquid electrolytes), mindful eating. There’s not much else I can personally do. Just resting out of it basically. Crying more than usual too idk but it feels good afterward lol Edit: by bed I mean BED. I literally don’t do anything else, I’m bed bound usually."
irr-pilot-394,covidlonghaulers,2021-11-29,comment,,,"Yes it’s diagnosed by an echo. It depends on what the cause is- cardiomyopathy can happen for many reasons. Usually, if diagnosed, a series of meds are prescribed to take the load off and help heal/rest the heart. I think it’s be too soon to speculate without the echo report."
irr-pilot-395,covidlonghaulers,2021-12-24,comment,,,Sports Research brand has a D3 paired with K2 and Coconut Oil. Best D supplement I’ve used - and the only one that’s actually increased my blood levels.
irr-pilot-396,covidlonghaulers,2021-11-29,comment,,,i used to because i had/have breathing problems but every time i checked it would be in normal ranges so i just stopped lol
irr-pilot-397,covidlonghaulers,2021-12-25,comment,,,Just following the thread .. but I feel SOB in two  different ways .  First. feels like I can’t breath out properly like i have to force out out my air . When my SOB feels really bad it feel like I’ve sprinted 40yrs and that feeling like your catching your breath but it doesn’t go away . 02 stats range from 98-95 …. FML
irr-pilot-398,covidlonghaulers,2021-12-11,comment,,,In the morning 120 some days. But it calms down when I walk calmly it's like 110. I've had some nights where it's really late and it's back in the 70s. I'm pretty sure it has to do with cortisol and the circadian rhythm
irr-pilot-399,covidlonghaulers,2021-11-18,comment,,,"I had an inhaler for ALVESCO (a steroid) and that seemingly helped. I used it for a few months I think? Take it once in the morning and once at night. Now i just have an inhaler for ALBUTEROL (emergency inhaler) for whenever my chest gets tight. I got asthma from covid so my albuterol inhaler is probably here to stay. I would recommend both, maybe in conjunction?"
irr-pilot-400,covidlonghaulers,2021-12-27,comment,,,Hmm I’ll have to look into it more. It sounds so promising and so far the science seems sound. Also I’m a prime candidate for this. Just wish it wasn’t so obscure so I knew what I’d be getting myself into. Thanks for your thoughts.
irr-pilot-401,covidlonghaulers,2021-11-15,comment,,,"My other problems have somewhat resolved, dizziness, headaches. Or maybe I have learnt to live with them. Most days I dont get them now.

Other things like shortness of breath, these allergies,  GI issues, not being able to walk more than 10 minutes, they started 5 months later and seriously there is no relief from them.

I am trying to meditate and trying to be happy. Sometimes those things help a lot."
