sample_id,subreddit,post_date,unit_type,title,parent_context,post_text
irr-pilot-271,covidlonghaulers,2021-11-11,post,Covid long haul advice,,"Hey everyone. I’ve been struggling with paresthesia in my legs (burning, tingling) for the past six months. Here’s my history: 

I think I may have contracted covid bc I had several close contacts, but never had a positive PCR. I started having paresthesia about 3 weeks after my first vaccination, and it hasn’t gone away since. I imagine these long haul side effects could be long covid exacerbated by the vaccine. For anyone else with the same symptoms, is there hope for a full recovery? How long did it take y’all to get better? What supplements worked? I have doctors in my own family, but sadly, they don’t have answers. I appreciate y’alls help. Thank you!"
irr-pilot-272,covidlonghaulers,2021-11-07,comment,,,"I suffer from the malaise and inablity to ""rest"" or even relax. I often put on a show and cant sit through five minutes, the malaise just makes me unable to do anything. I'm usually really high to handle it because its pretty miserable most of the time. Coming up on my two year mark and im starting to occasionally sleep better with melatonin but its still fukt. Definitely getting more than 2 hours though thats brutal"
irr-pilot-273,covidlonghaulers,2021-12-25,comment,,,"Not trying to scare anyone, I'm one of y'all, previously a covid long hauler. First Pfizer cured me, second I had mcas symptoms which resolved w benadryl. Moderna booster has been awful. I don't think I needed the booster. Yet to have a diagnosis but I went to the er once already. My heart is not right, everything feels inflamed in that area. Discomfort, heart palps, heart pounding, indistinct but significant malaise just generally feel terrible. I have a cardio appt Jan 4 so hoping to get on some meds to help."
irr-pilot-274,covidlonghaulers,2021-12-04,comment,,,"I stopped talking about it to anyone it seems like im the only one in california with long covid symptoms  or thats how they make it seem , like their brains cant possibly concieve that people get post virus symptoms , so i stopped waisting the little oxygen i have left and actually when i did see a therapist she actually believed me completely she was very helpful my doctor said hes never heard of what im goong through which i have to think is impossible, its honestly like their bosses tell them to act like its not real so we cant get disibilty or something"
irr-pilot-275,covidlonghaulers,2021-12-22,comment,,,"During the phase where I had the bulging veins/tendons, I also had pitting edema in the palms and soles.  Nowhere else. I was never able to pin down what exactly was holding the swelling - eventually I gave up and then it did stop happening after about 4 months."
irr-pilot-276,covidlonghaulers,2021-12-05,comment,,,I had a tapered 4mg dose pack of methylprednisolone I took the pack for five days and then a few weeks later I took another course. My tinnitus and dizziness cleared up the tinnitus comes back with poor posture oddly enough but if I correct it’s gone in a few minutes. No dizziness to speak of.
irr-pilot-277,covidlonghaulers,2021-12-04,comment,,,"The reason I’m not vaxxed is this: I have no idea why but even after being directly exposed I have never tested positive or experienced anything like my first infection. I also know the risk is very small, but there is a possibility of relapse and worsening of symptoms. I’m also a fairly young man and the risk of myocarditis is there. I had myocarditis during my acute illness. I never want to experience that again.

I’m also appalled at the amount of people advocating for forced vaccinations. I’m generally not anti vax but this vaccine seems totally pointless."
irr-pilot-278,covidlonghaulers,2021-11-09,comment,,,"when i fast like a psycho for weeks without potassium supps, i twitch like crazy. covid has been shown to down electrolytes for some reason. take a multivitamin, eat salmon and even get potassium citrate powder off amazon. careful u can die if u overdose in the powder via heart attack. always see health professional im not a doc"
irr-pilot-279,covidlonghaulers,2021-12-02,comment,,,"I have the opposite. I can go days without feeling hunger -- in fact, I feel full all the time unless I can afford some edibles (not often).  I've lost a ton and am still losing. 

Good luck..."
irr-pilot-280,covidlonghaulers,2021-12-30,comment,,,"I needed medication to lower my blood pressure for a couple of months. It's back to normal now, and I mostly just have energy problems now."
irr-pilot-281,covidlonghaulers,2021-11-11,comment,,,"I’ve been using Liquid IV brand but I’m switching over to Trioral as I think it’s more effective and it’s substantially cheaper—I just don’t like how it tastes. Trioral uses the formula recommended by WHO. There’s some good research on the effectiveness of this vs IV saline infusions in a study called Oral Rehydration Solution More Effective than Saline IV at Improving Orthostatic Intolerance. There’s an article summing it up [here.](https://www.healthrising.org/blog/2020/09/15/saline-ors-oral-rehydration-pots-chronic-fatigue-syndrome/) I happened to respond to it amazingly well, probably because I’m just barely into the POTS criteria, but everyone’s mileage will vary."
irr-pilot-282,covidlonghaulers,2021-11-12,comment,,,"Hey so I read your posts. I actually have been taking a really good low histamine probiotic for 2 weeks now as well, which restored my ability to have bowel movements and eat a lot of garlic and proper diet with fruits and vegetables. I have no fatigue or other symptoms at this point besides some passing chest pain. So I am still a little concerned that my allergic response has gotten worse, despite me taking proper steps."
irr-pilot-283,covidlonghaulers,2021-12-29,comment,,,Yes this stuff. My symptoms vary- sometimes it’s itchy and lots of nuero issues. The QBC acts like a natural antihistamine- and boosts the immune system. It’s not helping my nuero issues but i feel better taking it.
irr-pilot-284,covidlonghaulers,2021-12-28,comment,,,I’ve had amazing results with constipation using PHGG in combination with L Rhamonosus GG and L Reuteri.   I’d be careful with inulin to begin with as it can feed the wrong bacteria depending on what’s going on in your gut.
irr-pilot-285,covidlonghaulers,2021-12-19,comment,,,"58M It is ironic that I actually LOOK better now than I did pre LH. 

I'm doing intermittent fasting, making & drinking milk kefir, meditation, super clean eating, eating Aloe Vera from my garden, Shilajit,  etc., etc., etc.

All of this has helped me become semi-functional but no cure. Life is bearable."
irr-pilot-286,covidlonghaulers,2021-11-15,comment,,,"Rest, hydration, a beta blocker for the tachycardia, a neurologist for the headaches (found out I had a mini stroke) a migraine medicine, a GI specialist because since Covid I keep getting pancreatitis,  a cardiologist for the arrhythmia and a antihistamine that is designed to treat the vertigo.  It’s an ordeal really.  I have to take so many medications now it’s ridiculous and I’m only in my 30’s.  Seriously, I would never wish this on anyone"
irr-pilot-287,covidlonghaulers,2021-11-29,comment,,,"My oxygen saturation level is good the doctors say, so there's nothing that I can do. My cousin uses an inhaler and I tried that and it helped for a little while but the relief didn't last long. I am just hoping it just goes away. I had a CAT scan of my lungs because the blood test indicated that I had blood clots (d-dymer) they said my lungs had spots, they called it Covid lungs, but they said that they didn't see any blood clots and sent me home."
irr-pilot-288,covidlonghaulers,2021-12-04,comment,,,"I just started PT not too long ago and am doing all laying down excersizes to build core and leg strength and got to do one pool session and will be doing more soon, that honestly was so nice to be able to be upright without the POTS symptoms because of the compression of the water, and just got a small fiber neuropathy punch done for tingling pain and numbness in my hands and feet too 

Crazy how insane this virus is"
irr-pilot-289,covidlonghaulers,2021-12-26,comment,,,Not ignoring it but your brain is building up tolerance to substances you giving it daily because it trys to function in its naturally way. There are also not really good studies to daily melatonin use and how the brain is affected by it. We only know that high doses of melatonin can cause heart arrythmia. The first days of using 1mg melatonin made me sleep very easy and fast. Now after few weeks it's like I took nothing.
irr-pilot-290,covidlonghaulers,2021-12-06,comment,,,"I’m month 11. I used to have terrible palpitations and skipped beats, almost always felt like my breath and heart stopped for a second, it’s the worst feeling. They actually went away for a few months but now they came back after a stressful few weeks and I’ve been having them again. I get about 10 or less in a day, at least i only notice those. It triggers my anxiety and that just makes them worse. But I guess that if I got rid of them once it’s possible again"
irr-pilot-291,covidlonghaulers,2021-12-06,post,Flu/cold,,"Have any of y’all hade the flu or cold while dealing with LH? A lot of people where I’m from have the flu or a bad cold right now and yesterday I started feeling like absolute dog shit with a headache, chills, full body aches and congestion. Have any of y’all dealt with this and if so, what came from it?"
irr-pilot-292,covidlonghaulers,2021-11-25,comment,,,"tried LDN? It's improving my condition, without any NSAIDs, etc.

I'm feeling the same, and LDN is just.. transparent enough, to take it - if neccessary - whole life. It's not neccessary to take every day. It's lowering my ""feeling of sickness"" significantly, also my heart rate is normal now. I feel also better in terms of depression.

It's anti inflammatory, anti-autoimmune, and just well, it's quite natural mechanism of action (secondary) - upregulation of endorphins. Substance on it's own in that amount (it's ""microdose"" is not making you feel much.

&#x200B;

I feel that it should be official medication for Long Covid."
irr-pilot-293,covidlonghaulers,2021-11-20,comment,,,I had covid March of 2020 started getting long haul October of 2020. Some of my symptoms were cured after I got my second dose of vaccine in April of2021 but the rest I am still dealing with.
irr-pilot-294,covidlonghaulers,2021-11-07,comment,,,I also have dizziness / lightheadedness after covid. Doctors are calling it dysautonomia. Any idea on how your platelets were if you had any blood work done? Mine are in range but are coming up on the lower end of the spectrum so relatively low. You mentioned how this could increase RBC so that caught my eye
irr-pilot-295,covidlonghaulers,2021-12-01,comment,,,"I'm coming up on 2 years soon. 
I just did a successful 8,000 step gentle hike in the woods.  I did not crash afterwards. First time. 
I have most of the neurological symptoms mentioned here, and constant hives, etc etc. 

I've been putting a drop of highest quality, pure frankincense essential oil under my tongue once or twice per day. This has been known to help heal neurological problems.  I'm taking a lot of brain vitamins plus MCT oil, etc. Also a lot of antioxidants like acai, vit C, etc
When I stay on top of these I feel definite improvement.  
I am definitely getting better but it has been slow going. I'm getting there."
irr-pilot-296,covidlonghaulers,2021-11-19,comment,,,What would be some easy to get ACE inhibitors or ARB? Is nicotine good or bad for this? I took NAC for a few days but did nothing
irr-pilot-297,covidlonghaulers,2021-11-20,comment,,,"Agreed!  Started taking it in my 30s for: carpal tunnel in my wrists, awful neck pain from several past car accidents, and a knee that would give out randomly.  I take a very small amount but it's amazing."
irr-pilot-298,covidlonghaulers,2021-11-03,post,Antibiotic amoxicillin,,"So I was prescribed amoxicillin for my linger cough and possible sinus infection after my 2nd exposure to covid. Each time I take my antibiotics, an hour later I start having all the symptoms I have with my covid long haul the first time I had it which is tingling muscle twitching and muscle spasms and some heart chest pain I’m not sure if this is a reaction of some sort (like a herx reaction). Anyone have similar effect from antibiotics thanks"
irr-pilot-299,covidlonghaulers,2021-11-16,comment,,,"If I have anymore turmeric I'll turn orange :)   
My 2nd vax was in May - my heart stuff started less than a month after. Coincidence? I don't know. I was pretty good about getting my walks in until the last few weeks when the pain started shortly into my walks and then would last for 4-5 days after."
irr-pilot-300,covidlonghaulers,2021-11-07,comment,,,"Can someone please explain why there is a barrage of negativity every time ivermectin is mentioned? It’s making it very difficult to determine if there is actually something wrong with the drug itself or if the issue is with idiots overdosing on the animal version. It’s also making it difficult to determine if it actually works or not! I am so confused. As far as I have seen, the hate seems to stem from concerns over ineffectiveness and administration. Do I have the right impression here?"
irr-pilot-301,covidlonghaulers,2021-11-18,comment,,,"I’m month 10 now & my fatigue & PEM have been really bad lately. I got Pfizer in September & my fatigue lifted for a few weeks. I slept for 11 hours last night & when I woke up I just wanted to go back to sleep. I had to drag myself out of bed. Is this normal, I can’t believe I’m still sleeping so long 10 months out & it’s not like I do anything to be this tired."
irr-pilot-302,covidlonghaulers,2021-11-12,comment,,,Its supposed to help with sleep and I think it personally cuts the malaise down a tad bit. I either sleep like a baby or have a really bad night about once every 10 days Id say. Other than that Im about 85% normal 10 months in with 1 zyrtec a day and 300 mg of nicotinic acid which also is just a form of the vitamin niacin. I split it into 3 100mg sections takin every 6 hours
irr-pilot-303,covidlonghaulers,2021-11-11,comment,,,Parosmia developed at 5 or so months later for me and I still have it at 9 months now. Hopefully it goes away.
irr-pilot-304,covidlonghaulers,2021-12-31,comment,,,"Was this the original post on ginkgo?

https://www.reddit.com/r/covidlonghaulers/comments/r4d2gr/ginkgo_biloba/

Ginkgo is also a fractalkine disruptor, if you’re following the research on nonclassical monocytes adhering to the endothelium through the fractalkine axis (CXC3R1/CXC3L1)."
irr-pilot-305,covidlonghaulers,2021-12-16,post,Cannabidiol? (CBD oil),,"Anybody had any success with treating their LH symptoms with CBD oil? If so, what symptoms did it help with?

I can’t do even smallish amounts of THC without it sending me into an absolute panic with heart palpitations for hours, but CBD seems to help a little with this weird jitteriness that I get on and off that seems related to my gut (like I get jittery/shaky when my gut doesn’t feel so great, and COVID hit me worst in the gut while I had it acutely 7 months ago)."
irr-pilot-306,covidlonghaulers,2021-11-17,comment,,,"Yes, it gets better.  Improvement is not linear, but continuous nonetheless.  Rest as much as you can tolerate, and be good to yourself.  You’ll get through it; it just takes a while."
irr-pilot-307,covidlonghaulers,2021-11-13,comment,,,"How long did it take to the point it does not affect you so greatly?
I think for me it's around 3-5 days every round; and for now it happens in a sequence for about a month. I get better for couple days, then racing heart, then everything all over again.

I am 4.5 month post 2nd M. First round lasted two months, then about a month of a break, now another month."
irr-pilot-308,covidlonghaulers,2021-12-17,comment,,,Yea I know exercise has a tendency to cause some relapse in symptoms so hopefully that won’t be the case. I just want to go back to normal living!
irr-pilot-309,covidlonghaulers,2021-12-21,comment,,,"I didn't have problems with my tongue, but my gums receded around some of my molars, and caused intensely painful sensitivity to everything I put in my mouth. My dentist had to give me a prescription level anti sensitivity toothpaste."
irr-pilot-310,covidlonghaulers,2021-12-13,comment,,,"I do deadlifts instead of squats, and they still take a lot out of me. Mid March 2020.

Breaking up my sets enough to never break a sweat seems to prevent feeling beaten up afterwards."
irr-pilot-311,covidlonghaulers,2021-12-31,comment,,,2nd for me too. Had some weird stuff going on before 2nd vax but the day after I got my 2nd I got hit w terrible symptoms including scary heart related symptoms. Was this how that went for you?
irr-pilot-312,covidlonghaulers,2021-11-09,comment,,,Nothing wrong with getting a diagnosis of anxiety or psychosis if they will action that into a prescription for a sigma 1 agonist like fluvoxamine to lower inflammation in the brain.
irr-pilot-313,covidlonghaulers,2021-11-05,comment,,,"ugh. well at least you have some sort of plan. my fatigue is a nightmare right now, along with the other stuff. I'm not sure how this clinic runs, but hopefully they have some new insights now.

thanks for the insightful reply, I hope you feel better soon!"
irr-pilot-314,covidlonghaulers,2021-12-25,comment,,,"Just thought I’d mention here that I had pretty bad leg pain for about 9 months. Truly bizarre, felt like I had done about a 5 kilometer hike every time I stood up. The pain would be slightly reduced with movement but then would come back full force as soon as I sat back down for 30 seconds. 

I did what some people in the sub suggested and took high doses of Vitamin D and that has reduced the pain and weakness from a 9 to a 1. So I know it feels hopeless. I do still have other symptoms that are worrisome like breathing issues but try your best to keep a bit of hope tucked away. I know it’s hard."
irr-pilot-315,covidlonghaulers,2021-12-24,comment,,,Sounds like I need to catch up myself as I wasn’t aware I could get long haul as result of the vaccine. I tried searching for this after my first shot and the symptoms first appeared but couldn’t find much and didn’t want to ask to be viewed as someone uninformed and slight conspiracist :) happen to have a link to source? TIA
irr-pilot-316,covidlonghaulers,2021-12-11,comment,,,"Get a cardiologist and tell them the problem. The hospital isn't thinking of long term solutions, they are thi king of right now problem fixes. Having a regular cardiologist will help because they can prescribe medication and send you for more tests to help.

Tell them you are a long hauler. They will probably give you a halter monitor to wear to check your heart over a long period of time."
irr-pilot-317,covidlonghaulers,2021-12-22,comment,,,"Yes visual snow, did nothing specific to target it but it was never a huge issue for me.

Time and possibly supplements, idk."
irr-pilot-318,covidlonghaulers,2021-12-05,comment,,,In addition to the mentioned ones i have been drinking Hops for sleep but read it is also anti-inflammatory: https://pubmed.ncbi.nlm.nih.gov/19655312/
irr-pilot-319,covidlonghaulers,2021-12-21,comment,,,Removing wheat from my diet and taking famotidine have helped the most. The first moderna also eliminated all gut issues except acid reflux.
irr-pilot-320,covidlonghaulers,2021-11-13,comment,,,"How long did your feeling of electrical shocks last? Mine occur in the trunk of my body and legs. After I got the Moderna vaccine they were jolts, but starting at nearly three weeks after having COVID they are now more severe, and more frequent. I’m trying to get in to see a neurologist. This is maddening!"
irr-pilot-321,covidlonghaulers,2021-12-23,comment,,,"Pfizer #1: sore arm and only some deep fatigue for a few days.  

Pfizer #2: sore arm and a 9 day relapse with chest pains and deep exhaustion (bed bound). After that, back to the 40% baseline.

Curious to what the booster will do."
irr-pilot-322,covidlonghaulers,2021-12-29,comment,,,"Rereading your statement for the 3rd time...

Have you taken a probiotic? A lot of those symptoms are gut related and suggest a microbiome imbalance in your gut. You could have a fungal overgrowth of Candida or Aspergillis going on that can cause a LOT of your symptoms. And that all takes a bit to get going after the primary infection. If you are taking a probiotic, it might be time to use a different one to push out an overgrowth.

I can go into more detail if you like or you are welcome to look at other posts of mine where I have offered more detail. I feel tired today... Allergies still suck."
irr-pilot-323,covidlonghaulers,2021-11-17,comment,,,"Well it’s only been 3 months for me so I haven’t had ay as long as others, it’s gotten better tho. I’ve found that being hydrated, trying to not to stress so much and eating clean has helped so far. I also been taking new supplements but I’m not sure if that is directly helping. I’m not an expert on this one but it’s all I got, hope it helps."
irr-pilot-324,covidlonghaulers,2021-12-12,comment,,,Yeah. Breakthrough infection July and started long hauling late august. First couple of months were hell but improving month on month.
irr-pilot-325,covidlonghaulers,2021-12-11,comment,,,"I’m interested getting the doctors information. I was in Oaxaca Mexico a few months ago, I went to see a doctor that send me to go get a bunch of testing, all testing came back clear. I was injected factor de transferencia, which I don't feel like it help much, I'm still in search of getting help for lingering symptoms, next month I'm traveling to Mexico city."
irr-pilot-326,covidlonghaulers,2021-11-10,comment,,,"I was also on the fence about it for the longest time. Would it help, or would it hurt? Considering I can't eat most things, and meds don't work right, I was absolutely terrified of it. However, I was more terrified of getting reinfected,  so ended up just biting the bullet and getting it done. Got Moderna, only side effect I had was a VERY sore arm at the injection site, 2nd shot I had a little extra fatigue for a day or two. I don't think it really helped the longhaul any, but it also didn't set me back either. I'll probably get the booster here as soon as I'm eligible."
irr-pilot-327,covidlonghaulers,2021-11-03,comment,,,"That could be a glutathione problem. NAC is a precursor to glutathione, doesn’t have an effect on NAD+ levels. You might have a gene mutation, it’s more common than people know. I have it. Cannot reduce glutathione back to its oxidized form. I dont do well on glutathione, but seem to tolerate NAC fine."
irr-pilot-328,covidlonghaulers,2021-12-13,comment,,,"Ah! Thanks for this info. I luckily did make a last minute decision on this most recent test to test renal labs with it.  I've been off Spiro for 7 months now and labs came back normal to the best of my understanding.  They were:

Aldosterone 6ng/dL (Reference Range 0-30)

Renin Plasma 0.892ng/dL (Reference Range 0.167-5.3)

 The Aldosterone/Renin ratio was 6.7 (Reference Range 0-30).  

Any insight if this is concerning? When I previously tested on Spiro I only tested aldosterone and it was 28."
irr-pilot-329,covidlonghaulers,2021-11-12,comment,,,"Sounds a bit similiar to me, young male and previosly fit, altough I know realized I also pushed myself too much with excercise. People do not realize that there is beneficial excercise, and harmful excercise. If you recover 100%, and have zero signs of overtraining/stress/cortisol, then its all good. 
I would actually ask you to consider laying off any excercise for 3 more months (except walking and moving in nature) because it probably does still harm you a little, especially every time you get PEM. I did mistake of going to gym too soon, but now I learned my lesson and wait as long as I have ANY symptoms"
irr-pilot-330,covidlonghaulers,2021-12-12,comment,,,Ahhhh gotcha. I didn’t realize they were giving monoclonal antibodies to people who didn’t have a new active infection of covid
irr-pilot-331,covidlonghaulers,2021-12-29,comment,,,"Terribly sorry you are going through this. I got lost in the woods myself and still can't find the way out 😔 I'm thankful to have made it this far but it's a daily suffering. Like you said, it feels like my body won't forgive me for eating the wrong foods now and my wooziness/lightheadedness would go crazy. I think the vaccination only made it worse for me and set me back maybe because it overstimulated my already over active immune system. Speaking of leaky gut, have you been tested for zonulin (sp?)? I'm also doing intermittent fasting in which I don't ear past 6pm. My gut is still in bad shape but it's miles better than it was couple mobths ago so I'll keep pushing in same direction."
irr-pilot-332,covidlonghaulers,2021-11-06,comment,,,"I think you should look into psychiatric medical intervention. It might be that time. And NOT because I think this is all in your head. But bc covid has obviously fucked your nervous system and your brain. 

I was ashamed to take them but they helped me get through my worst of worst times. 

You gotta do what you need to do to get through this. If that means go to a psych hospital for help, that's what it means. 


You got this"
irr-pilot-333,covidlonghaulers,2021-11-02,comment,,,Yea my ENT did a few different BPPV excercises while i was there and it didn’t trigger it or help it. I did the saline sprays as well as allergy meds ( have never had allergies) for a few months to try that with no luck.
