sample_id,subreddit,post_date,unit_type,title,parent_context,post_text
irr-pilot-001,covidlonghaulers,2021-11-28,comment,,,"Pretty new to Reddit, I tried looking at ur profile but there was a bunch of stuff lol. I guess my question is was light headedness/vertigo feeling one of ur symptoms?"
irr-pilot-002,covidlonghaulers,2021-12-06,comment,,,"They've got a Slack group, which has been a HUGE help to me. I recommend that anyone with long covid join it."
irr-pilot-003,covidlonghaulers,2021-12-18,comment,,,"Beep. Boop. I'm a robot.
Here's a copy of 

###[Candida]( https://snewd.com/ebooks/candida/)

Was I a good bot? | [info](https://www.reddit.com/user/Reddit-Book-Bot/) | [More Books](https://old.reddit.com/user/Reddit-Book-Bot/comments/i15x1d/full_list_of_books_and_commands/)"
irr-pilot-004,covidlonghaulers,2021-11-16,comment,,,Glad to hear that. I’ve been on statins 5mg for about two weeks and feel a little bit more energy. They are apparently a powerhouse anti inflammatory. I just started adding baby aspirin as well so we’ll see how that goes. I’m also taking Ivermctin twice a week but not sure if it’s really helping.
irr-pilot-005,covidlonghaulers,2021-12-10,comment,,,I got covid about 5 months ago and was really confused so i didnt get checked for that  but Maybe I did. I Didn't know that was a symptom just looked it up.I had to get fluids and IV potassium like 6 or 7 times because my levels were low and I was weak and faint and had went to the hospital. My potassium kept dropping the first two months but i dont feel like i have that problem as much now. I drank a bunch of coconut water and ate a bunch of potatoes and bananas every day. I also took alpha lipoic acid and i think that helped with the shakyness somehow. I do still feel a bit shaky at times still but the cymbalta has for sure helped I feel. Anyways best of luck to you!
irr-pilot-006,covidlonghaulers,2021-11-01,comment,,,">With time I figured out it was autoantibidies + glutamate excitotoxicity.

That makes a lot of sense; I started taking glutamine to help my gut barrier and it was nice at first, but after a couple of days it started to make me super anxious and ""brain foggy"", presumably as the glutamine was turned into glutamate in my brain. Probably made worse by the fact I'm on ritalin, which apparently increases glutamate transmission to NMDA receptors."
irr-pilot-007,covidlonghaulers,2021-11-23,post,Booster shot?,,"Has anyone here had their 3rd dose? What was your experience like?  


I'm double vaxxed with Moderna and have had long covid since January. I'm a lot better now but still not recovered"
irr-pilot-008,covidlonghaulers,2021-12-01,comment,,,"It could be vitamins deficiency. I didnt think of that. I know that i was heavily taking supplements AFTER I got sick and i didnt have any bad symptoms. Until i stopped taking them. Then my hair falls out, i get ultra mental issues and i feel ny chest was gonna implode."
irr-pilot-009,covidlonghaulers,2021-11-07,comment,,,"The negativity is because it Does Not Work for COVID. It's a drug for worms. There have been several studies, plus one pretty thorough meta-analysis - and the ONLY time Ivermectin has done anything against COVID is in petrie dishes at doses high enough to kill a human. Otherwise, it's no more effective than taking a peppermint, but with higher risks.

It's become political because a certain segment of society has decided they prefer to believe politicians over scientists."
irr-pilot-010,covidlonghaulers,2021-11-12,comment,,,"Because insurance won’t cover it and the doctor can have his/her actions questioned if they are ordering advanced testing without cause. Cause being an abnormality in earlier testing. It sucks, but that’s the system we are all fighting right now. I used to work in it and now I’m fighting the same uphill battle as you."
irr-pilot-011,covidlonghaulers,2021-11-02,comment,,,"Yes, had bloodwork done a few times since this started. Everything normal except for the blood glucose in the beggining. I was 197 in april and now 175. i’m 28 male"
irr-pilot-012,covidlonghaulers,2021-11-17,comment,,,"Hi, I’ve had this since the beginning of my long haul as well and I’m sorry you’re going thru it, I know how much it sucks. I still can’t manage to sleep through the whole night without waking up but I am able to fall asleep without the jolts every night with L-Theanine magnesium glycinate, melatonin and taurine. If I don’t take these to calm down my nervous system I definitely will get the jolts that keep me up for hours. Hope this helps!"
irr-pilot-013,covidlonghaulers,2021-12-31,post,Reinfection 3 days after quarantine? Am I still contagious?,,"I had omicron (tested positive on a PCR). I am double vaccinated. I quarantined for 10 days. I had symptoms (runny nose, coughing up mucus, sneezing, coughing, sore throat, hoarse voice) on days 3-5 then felt totally better. After day 10 I felt totally fine and returned to seeing people. 

Now on days 13 and 14 I have my same symptoms again (congestion, cough, sore throat, hoarse voice). Am I still contagious? Did I reinfect myself this soon? Is that even possible?"
irr-pilot-014,covidlonghaulers,2021-12-09,post,What is going on with me? *neuro crap*,,"Ugh just when I thought I was getting better I get more set backs. What is going on with me? The sweating problem is back, the air hunger or tight throat hasn’t gone away yet, and I’ve been feeling random pressures/feelings all over my body. I also went to physical therapy yesterday to strengthen my muscles, but after a test they think my muscles are fine but my arms still feel like a noodle when I hold something.

Jesus Christ has this happened to anyone? Does this shit get better?"
irr-pilot-015,covidlonghaulers,2021-12-24,comment,,,"Also very interesting to hear your take! Interesting for me, antihistamines didn’t do anything! I don’t have any mcas or sensitivities, and fatigue wasn’t a main part of my symptom cluster.  By looking at my neutrophils, and the big decline, we decided to peruse some anti-microbial treatments.

The reason I started Buhner was because I tested positive on IgG for western blot for Lyme, on some Lyme specific bands. My doctor suggested starting Buhner as there’s really nothing to lose and are well tolerated.

Nicotine helped with my visual system and helps to clear out a bunch of my cognitive problems.  I do limit myself to 2x per day.

I hope that they do some extensive immune system studies because it sounds like there are many different modalities which correlate to different symptoms."
irr-pilot-016,covidlonghaulers,2021-12-16,comment,,,"No, statin is a prescription. Oh I totally relate! I wish by now there was so much more data about what's going on with early long haulers so that you could get better so much faster."
irr-pilot-017,covidlonghaulers,2021-12-19,comment,,,Search the sub for microclotting/microclots and you'll find relevant links. Some of us are seeing improvement taking natto/serra (enzymes that break down microclotting).
irr-pilot-018,covidlonghaulers,2021-12-30,comment,,,">got a round of antibiotics prescribed which is working fast

Did he test positive for covid? Why were antibiotics prescribed for a viral infection?"
irr-pilot-019,covidlonghaulers,2021-12-10,comment,,,"Most my family doesn’t really believe the vax injury. But the closest people do, so thats what’s important. Im still early in seeking medical care, good thing is my neurologist didn’t outright dismiss the vax being a cause. As for covid im starting to make Drs apps for my heart and lungs so we’ll see what happens with that. I think my PCP thinks im exaggerating my symptoms because i went to the ER twice because of covid."
irr-pilot-020,covidlonghaulers,2021-12-05,comment,,,"Same.

19M

Covid in august 2020. Brain fog was slowly increasing. Speech problems came on 5th month, now 15+ months in longhaul and can't think properly and its not going to stop (I feel worse and worse), claritin, Acetyl L-carnitine, Omega-3 don't help"
irr-pilot-021,covidlonghaulers,2021-11-26,comment,,,I got the booster because I work at a school with kids who aren’t vaccinated and I‘ve already been exposed multiple times this year. I am a long hauler and I don’t want to get it again and make my long haul worse. But I had no reaction to my first dose of the vaccine and my long haul symptoms went away for a couple months after the second dose of the vaccine (they came back) so it was a pretty easy decision to get the booster since my experience with the first two doses was positive.
irr-pilot-022,covidlonghaulers,2021-11-14,comment,,,"Against a new virus it has not encountered before? In a way, yes.

It took thousands of years for what we now know as the common cold to become what it is. Once upon a time it also killed and maimed tons of people. Evolution does not happen overnight. It takes generations. We are not the humans evolved to live with covid, those haven’t been born yet. It’s why we have vaccines for flu, measles, smallpox,… also.

The fact that you are not one of the people adapted to live with covid should be evident by your long covid. We - along with the people who died - are the ones nature would select out if it wasn’t for medicine and vaccines."
irr-pilot-023,covidlonghaulers,2021-12-10,comment,,,"I’m on it for 6+ months and it hasn’t helped much overall. May be it does with the anxiety but overall no noticeable change in the long run. I have added mirtazapine and abilify few days ago, hopefully they will help at least for the neuro stuff."
irr-pilot-024,covidlonghaulers,2021-12-17,comment,,,"My LH symptoms got significantly worse after a round of antibiotics. So researching more, I was almost convinced that I had candidiasis and this was causing my issues. I also had oral thrush (Nystatin took care of that in about a week). But, before taking the Nystatin, I did a candida blood test and comprehensive GI map stool test that included checking for candida, and those both were totally normal. So, I’m not sure if the tests aren’t that accurate, or if my initial thought of having candida overgrowth was incorrect."
irr-pilot-025,covidlonghaulers,2021-12-02,comment,,,"Walking, yoga, and recently…cycling. I keep pushing myself even though I feel like crap because my weight has been so out of control since COVID. It’s the only thing keeping me from weighing 250lbs."
irr-pilot-026,covidlonghaulers,2021-11-22,comment,,,"It is a yearly MRI scan to monitor my root and ascending aortic aneurysms to see if I need to undergo open heart surgery

The aneurysms were initially discovered after a chest CT scan for chest pain in the ER, March 2020. I tested positive for covid-19 before and during the hospital visit.

I got quick and long term side effects from the CT contrast dye, so I opted for the chest MRI"
irr-pilot-027,covidlonghaulers,2021-11-26,comment,,,"The vaccine mostly cured me from COVID long-haul. My long-haul daughter is showing improvement after the pediatric vaccine, also."
irr-pilot-028,covidlonghaulers,2021-11-13,comment,,,"Yeah many have this :) it should resolve in 6 months. Some have it for 1,5 year and then it has resolved. Don't push yourself and try not to worry too much.

I've had this since July 2021 and my heart has been examined and it's healthy. It's caused by something else than the heart itself and it's harmless according to all the doctors I've seen."
irr-pilot-029,covidlonghaulers,2021-11-15,comment,,,"Yeah tried electrolyte drinks… hasn’t helped. I’ve had so many blood tests this past year I think one of the veins in my arm’s stopped working :) All blood tests have been totally normal (iron, CRP, thyroid, full blood count, autoimmunity-related tests, etc.)"
irr-pilot-030,covidlonghaulers,2021-12-30,post,Omicron for unvaccinated,,"Any unvaccinated people get omicron if so how mild or severe are the symptoms and how long did they last you

Is getting Covid a second time usually lighter or does it hit harder"
irr-pilot-031,covidlonghaulers,2021-11-03,comment,,,"I'm quite out of my depth here but elevated VWF can be associated with thrombosis. Vitamin K promotes clotting factors (mostly a good thing) so maybe supplementation of this vitamin isn't the best in this scenario?

Vitamin E, Cinnamon, Ginger, Ginko Biloba, Bromelain are linked to lowering platelets or clotting factors. These are complex processes though and targeting the wrong enzyme could have unexpected results. I'm also unclear how this is linked to the anti h1 histamines you've been prescribed. I'd love to know more about this."
irr-pilot-032,covidlonghaulers,2021-12-13,comment,,,"These antivirals don't target covid, they're meant for herpes viruses which is a totally different family that stay with us after first infection in the form of latent cells. Read about viral latency and herpes viruses"
irr-pilot-033,covidlonghaulers,2021-12-26,comment,,,"Niacinamide is better for people with histamine intolerance, according to this book

https://www.histamine-sensitivity.com/books/beginners-guide-05-17.html"
irr-pilot-034,covidlonghaulers,2021-11-19,post,Anyone Know how do deal with Joint pain?,,"One if the most disabling symptoms is my full body joint pain. Knees, angles, toes, wrists, arms, shoulders, chest, they all have sever pain and get stiff and rub really bad, and often pop really loudly. Wondering if this is common and if anyone knows hot to deal with the pain outside of popping ibuprofen like tik tacs. Only time I've ever felt ok was on narcos for wisdom tooth extraction."
irr-pilot-035,covidlonghaulers,2021-12-08,comment,,,"I have been taking then together (assuming zytek is fexofenadine?) and they've helped my brain fog.
My ENT doctor actually showed me an article in the British medical journal and I've got the dosages slightly wrong so just adjusted."
irr-pilot-036,covidlonghaulers,2021-11-02,comment,,,"Sorry. myself as well.  Been trying so hard. Already lost my job. friends and family are finally coming around again. Gonna lose the house and car next. Or I starve. Better sell all the stupid fucking tools I can't even use anymore. My legs are suffering from venous insufficiency or some kind of vascular dysfunction. I've developed serious Raynaud's. My foot get so cold it almost fucking fell off. In my house at room temperature!
I'm getting an arterial doppler ultrasound this month when the specialist is in town. Only hope I've got.
I bounced around quite a number of walk-in clinics, teledocs, and hospitals, until I finally lucked out and got good advice.
Try a health guidance hotline."
irr-pilot-037,covidlonghaulers,2021-12-07,comment,,,"My first vaccine was temporary help from brain fog depression.

Second vaccine gave me increased fatigue.

If I had a crystal ball I woulda skipped the second one.. but.. that's me."
irr-pilot-038,covidlonghaulers,2021-12-11,comment,,,"I had horrible tinnitus and noise sensitivity post 1st dose as well in addition to rashes, skin burning, sensitivity, etc.  I'll never know if it would've gone away because I went into covid a week later. It was baaaaad."
irr-pilot-039,covidlonghaulers,2021-12-12,comment,,,"> now it seems like my bone density is shrinking especially in my skull.

Sorry, can you clarify this?"
irr-pilot-040,covidlonghaulers,2021-11-24,comment,,,"I'm further north in BC and having trouble getting ANY doctor to listen. Allergist wait (in the early days I was told it's just allergies) was 9 months. Cardiologist - 3 month wait. Now I'm in line for a rheumatologist - 6 month wait. 

Have you tried any of these online doctor appointments? Naturopaths?"
irr-pilot-041,covidlonghaulers,2021-12-26,comment,,,I've been close to recovery for the past two months but I keep having horrible relapses. If I totally recover I will tell everyone so that they have some hope.
irr-pilot-042,covidlonghaulers,2021-12-21,comment,,,"To answer ur Q don’t know. In hindsight it took away the dizziness but it elevated my already post COvid  high blood pressure - which may not be the best for people with BP issues or clotting or general vascular concerns - read as LHRs 
So That’s a doctor question."
irr-pilot-043,covidlonghaulers,2021-12-11,comment,,,Adderall and B12 seem to work best for me. I haven't tried lions mane or ginkgo mentioned above. I will try those.
irr-pilot-044,covidlonghaulers,2021-12-03,comment,,,"Cymbalta made my symptoms worse, especially my heart rate. My HR was incredibly high while sitting out laying down"
irr-pilot-045,covidlonghaulers,2021-12-06,comment,,,"Do you have pots? Other things like excessive water and salt may help you.
That said I have taken metoprolol and atenolol currently. No side effects from atenolol that I can accurately decipher amongst long haul symptoms. Metroprolol made my insomnia worse"
irr-pilot-046,covidlonghaulers,2021-11-17,comment,,,"I think what CW2050 might be trying to say is that the damage we're seeing to our brains/nervous system is more linked to the protien spike on the outside of the COVID virus rather than the virus body.  The vaccine sends messenger rna to your cells and takes over protien production.  Our own cells then grow the protien spikes, which is why some people are developing LH from only the vaccine."
irr-pilot-047,covidlonghaulers,2021-12-17,comment,,,"I’ve actually taken SSRIs before, and came off them with no issue. My long covid symptoms started after I had covid, when I wasn’t taking SSRIs. Plus my long covid symptoms don’t mimic seratonin withdrawal symptoms anyway"
irr-pilot-048,covidlonghaulers,2021-11-08,post,Black seed oil,,"Has anyone tried it? I’ve been on it for almost a week now and it’s helped me immensely. I saw a video where a vaccine long hauler said it helped them. I’m assuming it’s because of its anticoagulant and anti inflammatory properties. It’s the first supplement that has actually made me feel different. The only other things that have taken the edge off for me have been Zyrtec and Pepcid. Here’s the kind I bought:

Limited-time deal: ZHOU Black Seed Oil | 100% Virgin, Cold Pressed Source of Omega 3 6 9 | Super antioxidant for Immune Support, Joints, Digestion, Hair & Skin | 60 Caps https://www.amazon.com/dp/B0779JC57M/ref=cm_sw_r_cp_api_glt_fabc_dl_RFQX0Z41FZSXAR3FAFGX?_encoding=UTF8&psc=1"
irr-pilot-049,covidlonghaulers,2021-11-14,comment,,,"Hi there. 30m. I have never had anxiety/depression. My mind/brain was/is broken since April. Started taking Zoloft (horrible experience) in early June. Prozac a couple weeks later which i've been on for 5 months. 

It's all a crapshoot. Some people respond to SSRI's some don't. One might be great for someone and bad for another person"
irr-pilot-050,covidlonghaulers,2021-12-06,comment,,,So the main healer for me came in starting low intensity exercise. I started going for walks daily out in the sun and the. When I could going for jogs. At first I couldnt eat animal protein as it would make me really nauseous but eventually i started eating chicken without a problem. I end every workout with a cold cold shower. No more fatigue no more brain fog.
irr-pilot-051,covidlonghaulers,2021-12-26,comment,,,"I just responded in this thread but please see my comment about magnesium! This helped me a TON with heart palpitations.  I was plagued with them for 3 years thanks to a medicine I was taking (diuretic) and covid made it worse.  It took a few weeks of supplementing and supplementing by itself.  Not with Vitamin D, Calcium or any other vitamin.  But there's a lot of evidence of depleted magnesium post infection due to increased physical and mental stress since adrenals use up magnesium to balance catecholamines."
irr-pilot-052,covidlonghaulers,2021-12-20,comment,,,"Antihistamines have helped me here. Not the ideal solution, because even the ""non drowsy"" ones aren't non drowsy, but it works for me."
irr-pilot-053,covidlonghaulers,2021-12-13,comment,,,"The neurological effects of covid are still poorly understood, even compared to the other aspects of long covid. The good news is that brain has much greater ability to heal itself than was assumed a few decades ago. I made a point of doing a lot of puzzles and mental challenges when I first got sick to stay sharp.

Regardless of neurological issues, acute and long covid can both be very traumatic. The first few days I thought I might die and it took me awhile to process that experience. Get a good therapist you can talk to about what you experienced."
irr-pilot-054,covidlonghaulers,2021-11-07,comment,,,I have already been at the doctor and apparantly already checked out everything and everything was fine. Still a pain in the ass though.
irr-pilot-055,covidlonghaulers,2021-12-18,comment,,,I have noticed some tick like twitches when I look a certain way. At the end of my head turn I’ll tick two or three times. Very strange because this has just started after 4 months of LH and wondered if it was a symptom. Thanks for sharing thought it was just me :/
irr-pilot-056,covidlonghaulers,2021-11-05,comment,,,"Am [taking this brand.](https://www.amazon.com/Doctors-Best-Natto-Serra-Non-GMO-Gluten/dp/B00DBEVTDE) Realized after purchase it's annoyingly vague on how much you're getting.

If it works I'll play around with the 2 compounds and dial in what I need."
irr-pilot-057,covidlonghaulers,2021-12-17,comment,,,"Specifically to thin the blood, I’m taking each of the below daily;
Vitamin E,
Grape Seed Extract,
Nattokinase,
Serrepeptasa,
Lumbrokinase,
Ginkgo biloba,

I also take a small aspirin once a week."
irr-pilot-058,covidlonghaulers,2021-12-26,comment,,,"14 days pretty tough, breathing problems and went to the ER twice. Then got better for a few days and started working and then it hit me again for another week."
irr-pilot-059,covidlonghaulers,2021-11-06,comment,,,"Sorry to hear that.  Pfizer was a turning point for me for the better however it wasn't the only thing, I feel it was a combination of things that helped me heal in addition to the vaccine and maybe it wouldn't have worked without the other things."
irr-pilot-060,covidlonghaulers,2021-11-13,comment,,,Yup keep yourself hydrated and eat a lot of fiber. Aloe Vera juice or apple cider can help to hydrate. Coconut water has proven to be game changer for me. Although if I eat something too spicy I feel dehydrated. It depends on how much roughage you’re eating. So yeah go green greens and drink more water. Stay strong it will pass. I am no longer facing this issue. So I would say stay patient and see it disappear.
irr-pilot-061,covidlonghaulers,2021-12-26,comment,,,I developed pretty severe PoTs at 12 months... I think I love had mild symptoms all along in some form! But at least I can put a label to it and get some meds
irr-pilot-062,covidlonghaulers,2021-11-29,comment,,,"It’s rescue but when you’re bad, 3 times a day is fine, whatever you need as long as it’s not like every couple hours. I’ve brought my neb to work, but I have an office but I can only work remotely right now but my office is full remote. I’m so so sorry. Make sure to bring albuterol for after the test, I thought I wouldn’t be able to do it but did. Nebulizers always work better for me than the inhaler because they really get deep into the airways."
irr-pilot-063,covidlonghaulers,2021-12-01,comment,,,"Worst fatigue for me has been characterized by extreme muscle weakness, physical and mental exhaustion, and brain fog.  The days when it's the worst, I can barely make it out of bed for a day or two and can only manage to sleep, go to the bathroom, and eat/drink.  It affects my ability to perform daily tasks including self-care.  There are days where I'll wake up with that type of fatigue and it will slowly dissipate throughout the day, allowing me to perform those daily tasks later in the evening."
irr-pilot-064,covidlonghaulers,2021-12-22,comment,,,And here we had the CDC recommending the vaccines as soon as you were out of quarantine after infection. Wouldn't be surprised if they are still recommending that
irr-pilot-065,covidlonghaulers,2021-11-09,comment,,,Thank you for sharing! Has anything helped at all? Have you tried checking potassium as the others have suggested?
irr-pilot-066,covidlonghaulers,2021-11-25,post,Long-term ibuprofen withdrawal symptoms?,,"I’ve been taking between 200-400mg of ibuprofen daily for at least 3 months (might be closer to 6, but time is hard to track this year). I want to stop taking it entirely because I’m going to be starting Prozac soon, but the last few days have been very odd - much more dizziness and poor coordination than usual. 

Could this be an effect of quitting the ibuprofen or is it more likely that I’m just having yet another random relapse and the timing is coincidental? Has anyone else taken ibuprofen daily for months at a time and experienced any difficulties getting off it?"
irr-pilot-067,covidlonghaulers,2021-12-15,comment,,,"I feel this is a difficult thing to answer. The reason being is time seems to be a healer for most of not all of us. So? It could have been the vaccine help push things along or just time.

For me personally, I didn’t feel any worse after both doses of pfizer. But I don’t know for sure it helped."
irr-pilot-068,covidlonghaulers,2021-11-03,comment,,,"Yes I got both and haven’t felt right since getting the 2nd shot of Pfizer, feels like the symptoms I had beofre are now back or were just hiding for when I stated work again which I just started last Monday. I feel terrible some days at work. I truly believe I have CFS with PEM only thing is I’m never tired I just feel like I have constant flu symptoms except for fever."
